{
  "schema_version": "1.4",
  "id": "roble_copa_ancha",
  "version": "2.2.0",
  "name": "Roble pintado con madera selectiva",
  "description": "Tres láminas por grupo y anillos de secundarias simplificados a 20 mm de correspondencia. Tronco, primarias, soportes, anclajes y pintura conservados. Piloto de 6812 tris aprobado; controles con revisión técnica separada.",
  "components": {
    "base": "oak_geometry_nodes@0.4.0",
    "distribution": "foliage-canopy@0.1.1",
    "representation": "oak-painted-crossed@0.2.0"
  },
  "parameters": {
    "base": {
      "height_m": 9,
      "base_radius_m": 0.8,
      "curvature": 0.16,
      "primary_branches": 11,
      "max_depth": 2,
      "branch_length_ratio": 0.55,
      "inclination_deg": 72,
      "asymmetry": 0.85,
      "foliage_density": 0.75,
      "foliage_scale_m": 1.3
    },
    "canopy": {
      "group_count": 264,
      "leaf_length_m": 1.0,
      "shell_depth_m": 0.08,
      "twig_radius_m": 0.02,
      "tip_radius_ratio": 0.25,
      "profile_width_scale": 1.0,
      "region_weights": {
        "north": 1.0,
        "east": 1.0,
        "south": 1.0,
        "west": 1.0
      },
      "layout_leaf_length_m": 1.0
    }
  },
  "appearance": {
    "bark": {
      "color_rgba": [
        1,
        1,
        1,
        1
      ],
      "roughness": 0.95,
      "metallic": 0,
      "double_sided": true
    },
    "leaf": {
      "color_rgba": [
        1,
        1,
        1,
        1
      ],
      "roughness": 0.95,
      "metallic": 0,
      "double_sided": true
    }
  },
  "editable_ranges": {
    "canopy.group_count": {
      "minimum": 24,
      "maximum": 360
    },
    "canopy.leaf_length_m": {
      "minimum": 0.2,
      "maximum": 1
    },
    "canopy.profile_width_scale": {
      "minimum": 0.85,
      "maximum": 1.15
    },
    "canopy.region_weights.north": {
      "minimum": 0,
      "maximum": 1
    },
    "canopy.region_weights.east": {
      "minimum": 0,
      "maximum": 1
    },
    "canopy.region_weights.south": {
      "minimum": 0,
      "maximum": 1
    },
    "canopy.region_weights.west": {
      "minimum": 0,
      "maximum": 1
    },
    "base.height_m": {
      "minimum": 2,
      "maximum": 20
    },
    "base.base_radius_m": {
      "minimum": 0.12,
      "maximum": 0.8
    },
    "base.curvature": {
      "minimum": 0.06,
      "maximum": 0.16
    },
    "base.primary_branches": {
      "minimum": 4,
      "maximum": 11
    },
    "base.max_depth": {
      "minimum": 2,
      "maximum": 2
    },
    "base.branch_length_ratio": {
      "minimum": 0.3,
      "maximum": 0.55
    },
    "base.inclination_deg": {
      "minimum": 35,
      "maximum": 72
    },
    "base.asymmetry": {
      "minimum": 0.15,
      "maximum": 0.85
    },
    "base.foliage_density": {
      "minimum": 0.5,
      "maximum": 0.75
    },
    "base.foliage_scale_m": {
      "minimum": 0.2,
      "maximum": 3
    }
  },
  "default_profile": "viejo_referencia",
  "profiles": {
    "viejo_referencia": {
      "description": "Piloto RF3 viejo-09 aprobado como referencia; no representa aprobación de todas las semillas.",
      "overrides": {},
      "validation": {
        "status": "experimental",
        "evidence": [
          "docs/evidence/roble-pintado/integracion-madera-01/informe.md"
        ]
      }
    },
    "joven": {
      "description": "Base Q3 joven; 264 grupos con hoja de 0.45 m, manteniendo la planificación de 1 m y los mismos soportes de B3 inicial.",
      "overrides": {
        "base": {
          "height_m": 4,
          "base_radius_m": 0.12,
          "curvature": 0.06,
          "primary_branches": 4,
          "max_depth": 2,
          "branch_length_ratio": 0.3,
          "inclination_deg": 35,
          "asymmetry": 0.15,
          "foliage_density": 0.5,
          "foliage_scale_m": 0.45
        },
        "canopy": {
          "leaf_length_m": 0.45
        }
      },
      "validation": {
        "status": "experimental",
        "evidence": [
          "docs/evidence/roble-pintado/integracion-madera-01/informe.md"
        ]
      }
    },
    "adulto": {
      "description": "Base Q3 adulto; 264 grupos y hoja nominal de 1 m comunes, sin ajuste por ejemplar.",
      "overrides": {
        "base": {
          "height_m": 10,
          "base_radius_m": 0.5,
          "curvature": 0.12,
          "primary_branches": 9,
          "max_depth": 2,
          "branch_length_ratio": 0.5,
          "inclination_deg": 65,
          "asymmetry": 0.6,
          "foliage_density": 0.75,
          "foliage_scale_m": 1.15
        }
      },
      "validation": {
        "status": "experimental",
        "evidence": [
          "docs/evidence/roble-pintado/integracion-madera-01/informe.md"
        ]
      }
    },
    "viejo": {
      "description": "Base Q3 viejo; 264 grupos y hoja nominal de 1 m comunes, sin ajuste por ejemplar.",
      "overrides": {
        "base": {
          "height_m": 9,
          "base_radius_m": 0.8,
          "curvature": 0.16,
          "primary_branches": 11,
          "max_depth": 2,
          "branch_length_ratio": 0.55,
          "inclination_deg": 72,
          "asymmetry": 0.85,
          "foliage_density": 0.75,
          "foliage_scale_m": 1.3
        }
      },
      "validation": {
        "status": "experimental",
        "evidence": [
          "docs/evidence/roble-pintado/integracion-madera-01/informe.md"
        ]
      }
    }
  },
  "limits": {
    "triangles": 12500,
    "materials": 2,
    "generation_seconds": 120
  },
  "resources": {
    "foliage": {
      "path": "assets/roble-pintado/v0.3.0/foliage.png",
      "sha256": "106959cc5497eeaaa03dc83ad238d1410d803deb3f54f7da4d2f118fb9d78af1"
    },
    "bark": {
      "path": "assets/roble-pintado/v0.2.0/bark.png",
      "sha256": "5ac6f45c53baa09bd5724560756bb9fa6439d167d4df45d1eb5b2cc45162543a"
    },
    "templates": {
      "path": "assets/roble-pintado/v0.3.0/templates.json",
      "sha256": "39d00e37cd1fa7ce3a2e8a4388b768c850e7455fa633032be1e65f0105c9006f"
    },
    "source_foliage": {
      "path": "assets/roble-pintado/v0.2.0/foliage.png",
      "sha256": "742fa095c8ba9d382afa4e73e35198b034632825a0e820942be75efbfcb0100d"
    },
    "source_layout": {
      "path": "assets/roble-pintado/v0.2.0/manifest.json",
      "sha256": "eae6bc4268a331ad7cd7984fd6ab8a8ec395659b8cbd3611bc3e2f05d901f250"
    }
  }
}
